Work,Intersection,Authors
Social Identity Theory, Identity group association ,Henri Tajfel; John Turner
Identity Crisis Theory, Identity crisis lifecycle , Erik Erikson; James Marcia
The Myth of Normal: Trauma Illness and Healing in a Toxic Culture | When the Body Says No: The Cost of Hidden Stress,,Gabor Maté
Sapiens: A Brief History of Humankind | Homo Deus: A Brief History of Tomorrow,,Yuval Harari
Structure Agency and the Internal Conversation,,Margaret Archer
What's Our Problem? A Self-Help Book for Societies,,Tim Urban
Understanding Media: The Extensions of Man,,Marshall McLuhan
Influence: The Psychology of Persuasion,,Robert Cialdini